Station ID,Site type,Data type (ID_type_****.csv),Station name,Latitude,Longitude
02GA031,Regulated,02GA031_Annual_Flow_tab.csv,BLUE SPRINGS CREEK NEAR EDEN MILLS,43.5761,-80.109
02GA031,Regulated,02GA031_Peak_Flow_tab.csv,BLUE SPRINGS CREEK NEAR EDEN MILLS,43.5761,-80.109
02GA039,Regulated,02GA039_Annual_Flow_tab.csv,CONESTOGO RIVER ABOVE DRAYTON,43.7835,-80.6378
02GA039,Regulated,02GA039_Peak_Flow_tab.csv,CONESTOGO RIVER ABOVE DRAYTON,43.7835,-80.6378
02GA040,Regulated,02GA040_Annual_Flow_tab.csv,SPEED RIVER NEAR ARMSTRONG MILLS,43.6386,-80.27
02GB010,Regulated,02GB010_Annual_Flow_tab.csv,MCKENZIE CREEK NEAR CALEDONIA,43.0339,-79.9498
02GB010,Regulated,02GB010_Peak_Flow_tab.csv,MCKENZIE CREEK NEAR CALEDONIA,43.0339,-79.9498
02GD001,Regulated,02GD001_Annual_Flow_tab.csv,THAMES RIVER NEAR EALING,42.9736,-81.2086
02GD001,Regulated,02GD001_Peak_Flow_tab.csv,THAMES RIVER NEAR EALING,42.9736,-81.2086
02GD003,Regulated,02GD003_Annual_Flow_tab.csv,NORTH THAMES RIVER BELOW FANSHAWE DAM,43.0408,-81.1828
02GD003,Regulated,02GD003_Peak_Flow_tab.csv,NORTH THAMES RIVER BELOW FANSHAWE DAM,43.0408,-81.1828
02GD008,Regulated,02GD008_Annual_Flow_tab.csv,MEDWAY RIVER AT LONDON,43.0137,-81.2804
02GD008,Regulated,02GD008_Peak_Flow_tab.csv,MEDWAY RIVER AT LONDON,43.0137,-81.2804
02GD016,Regulated,02GD016_Annual_Flow_tab.csv,THAMES RIVER AT INGERSOLL,43.0413,-80.8862
02GD016,Regulated,02GD016_Peak_Flow_tab.csv,THAMES RIVER AT INGERSOLL,43.0413,-80.8862
02GE002,Regulated,02GE002_Annual_Flow_tab.csv,THAMES RIVER AT BYRON,42.9625,-81.3318
02GE002,Regulated,02GE002_Peak_Flow_tab.csv,THAMES RIVER AT BYRON,42.9625,-81.3318
02HA003,Regulated,02HA003_Annual_Flow_tab.csv,NIAGARA RIVER AT QUEENSTON,43.1569,-79.0472
02HA007,Regulated,02HA007_Annual_Flow_tab.csv,WELLAND RIVER BELOW CAISTOR CORNERS,43.0218,-79.618
02HA007,Regulated,02HA007_Peak_Flow_tab.csv,WELLAND RIVER BELOW CAISTOR CORNERS,43.0218,-79.618
02HB001,Regulated,02HB001_Annual_Flow_tab.csv,CREDIT RIVER NEAR CATARACT,43.8359,-80.0229
02HB001,Regulated,02HB001_Peak_Flow_tab.csv,CREDIT RIVER NEAR CATARACT,43.8359,-80.0229
02HB005,Regulated,02HB005_Annual_Flow_tab.csv,SIXTEEN MILE CREEK AT MILTON,43.5139,-79.8797
02HB005,Regulated,02HB005_Peak_Flow_tab.csv,SIXTEEN MILE CREEK AT MILTON,43.5139,-79.8797
02HB008,Regulated,02HB008_Annual_Flow_tab.csv,CREDIT RIVER WEST BRANCH AT NORVAL,43.6466,-79.8663
02HB008,Regulated,02HB008_Peak_Flow_tab.csv,CREDIT RIVER WEST BRANCH AT NORVAL,43.6466,-79.8663
02HB011,Regulated,02HB011_Annual_Flow_tab.csv,BRONTE CREEK NEAR ZIMMERMAN,43.4369,-79.8643
02HB013,Regulated,02HB013_Annual_Flow_tab.csv,CREDIT RIVER NEAR ORANGEVILLE,43.8913,-80.0624
02HB013,Regulated,02HB013_Peak_Flow_tab.csv,CREDIT RIVER NEAR ORANGEVILLE,43.8913,-80.0624
02HB015,Regulated,02HB015_Annual_Flow_tab.csv,SPENCER CREEK NEAR WESTOVER,43.3531,-80.0779
02HC003,Regulated,02HC003_Annual_Flow_tab.csv,HUMBER RIVER AT WESTON,43.6989,-79.5204
02HC003,Regulated,02HC003_Peak_Flow_tab.csv,HUMBER RIVER AT WESTON,43.6989,-79.5204
02HC005,Regulated,02HC005_Annual_Flow_tab.csv,DON RIVER WEST BRANCH AT YORK MILLS,43.7402,-79.4031
02HC005,Regulated,02HC005_Peak_Flow_tab.csv,DON RIVER WEST BRANCH AT YORK MILLS,43.7402,-79.4031
02HC017,Regulated,02HC017_Annual_Flow_tab.csv,ETOBICOKE CREEK AT BRAMPTON,43.6916,-79.7594
02HC024,Regulated,02HC024_Annual_Flow_tab.csv,DON RIVER AT TODMORDEN,43.6859,-79.3615
02HC024,Regulated,02HC024_Peak_Flow_tab.csv,DON RIVER AT TODMORDEN,43.6859,-79.3615
02HC027,Regulated,02HC027_Annual_Flow_tab.csv,BLACK CREEK NEAR WESTON,43.6743,-79.5044
02HC027,Regulated,02HC027_Peak_Flow_tab.csv,BLACK CREEK NEAR WESTON,43.6743,-79.5044
02HD010,Regulated,02HD010_Annual_Flow_tab.csv,SHELTER VALLEY BROOK NEAR GRAFTON,43.9919,-78.0012
02HD010,Regulated,02HD010_Peak_Flow_tab.csv,SHELTER VALLEY BROOK NEAR GRAFTON,43.9919,-78.0012
02HF002,Regulated,02HF002_Annual_Flow_tab.csv,GULL RIVER AT NORLAND,44.7318,-78.8181
02HF002,Regulated,02HF002_Peak_Flow_tab.csv,GULL RIVER AT NORLAND,44.7318,-78.8181
02HF003,Regulated,02HF003_Annual_Flow_tab.csv,BURNT RIVER NEAR BURNT RIVER,44.7099,-78.6775
02HF003,Regulated,02HF003_Peak_Flow_tab.csv,BURNT RIVER NEAR BURNT RIVER,44.7099,-78.6775
02HJ003,Regulated,02HJ003_Annual_Flow_tab.csv,OUSE RIVER NEAR WESTWOOD,44.2981,-78.0449
02HJ003,Regulated,02HJ003_Peak_Flow_tab.csv,OUSE RIVER NEAR WESTWOOD,44.2981,-78.0449
02HL001,Regulated,02HL001_Annual_Flow_tab.csv,MOIRA RIVER NEAR FOXBORO,44.2537,-77.4188
02HL001,Regulated,02HL001_Peak_Flow_tab.csv,MOIRA RIVER NEAR FOXBORO,44.2537,-77.4188
02HM002,Regulated,02HM002_Annual_Flow_tab.csv,DEPOT CREEK AT BELLROCK,44.4719,-76.7624
02HM002,Regulated,02HM002_Peak_Flow_tab.csv,DEPOT CREEK AT BELLROCK,44.4719,-76.7624
02HM006,Regulated,02HM006_Annual_Flow_tab.csv,MILLHAVEN CREEK NEAR MILLHAVEN,44.2264,-76.7591
02KB001,Regulated,02KB001_Annual_Flow_tab.csv,PETAWAWA RIVER NEAR PETAWAWA,45.8862,-77.3153
02KB001,Regulated,02KB001_Peak_Flow_tab.csv,PETAWAWA RIVER NEAR PETAWAWA,45.8862,-77.3153
02KC009,Regulated,02KC009_Annual_Flow_tab.csv,BONNECHERE RIVER NEAR CASTLEFORD,45.4965,-76.5646
02KC009,Regulated,02KC009_Peak_Flow_tab.csv,BONNECHERE RIVER NEAR CASTLEFORD,45.4965,-76.5646
02KF001,Regulated,02KF001_Annual_Flow_tab.csv,MISSISSIPPI RIVER AT FERGUSONS FALLS,45.0533,-76.2861
02KF005,Regulated,02KF005_Annual_Flow_tab.csv,OTTAWA RIVER AT BRITANNIA,45.3512,-75.8267
02KF005,Regulated,02KF005_Peak_Flow_tab.csv,OTTAWA RIVER AT BRITANNIA,45.3512,-75.8267
02KF006,Regulated,02KF006_Annual_Flow_tab.csv,MISSISSIPPI RIVER AT APPLETON,45.1763,-76.1235
02KF006,Regulated,02KF006_Peak_Flow_tab.csv,MISSISSIPPI RIVER AT APPLETON,45.1763,-76.1235
02KF012,Regulated,02KF012_Annual_Flow_tab.csv,INDIAN RIVER NEAR BLAKENEY,45.2454,-76.2603
02KF012,Regulated,02KF012_Peak_Flow_tab.csv,INDIAN RIVER NEAR BLAKENEY,45.2454,-76.2603
02LA004,Regulated,02LA004_Annual_Flow_tab.csv,RIDEAU RIVER AT OTTAWA,45.3815,-75.697
02LA004,Regulated,02LA004_Peak_Flow_tab.csv,RIDEAU RIVER AT OTTAWA,45.3815,-75.697
02LC008,Regulated,02LC008_Annual_Flow_tab.csv,"NORD (RIVIERE DU) A 4,8 KM EN AMONT DU PONT DU C.N. A SAINT-JEROME",45.7931,-74.0128
02OA054,Regulated,02OA054_Annual_Flow_tab.csv,CHATEAUGUAY (RIVIERE) Ë 2 KM EN AMONT DU PONT-ROUTE 132,45.3319,-73.7619
02OB008,Regulated,02OB008_Annual_Flow_tab.csv,L'ASSOMPTION (RIVIERE) AU PONT-ROUTE 158 Ë JOLIETTE,46.0103,-73.4275
02OD010,Regulated,02OD010_Annual_Flow_tab.csv,BULSTRODE (RIVIERE) A SAINT-VALERE-1,46.07,-71.9789
02OE024,Regulated,02OE024_Annual_Flow_tab.csv,SAINT-FRANCOIS (RIVIERE) AU RESERVOIR SAINT-FRANCOIS,45.945,-71.2783
02OG002,Regulated,02OG002_Annual_Flow_tab.csv,YAMASKA (RIVIERE) Ë FARNHAM,45.2825,-72.9658
02OG019,Regulated,02OG019_Annual_Flow_tab.csv,"NOIRE (RIVIERE) Ë 7,6 KM DE LA YAMASKA",45.4997,-72.9064
02PC002,Regulated,02PC002_Annual_Flow_tab.csv,JACQUES-CARTIER (RIVIERE) EN AVAL DU PONT DU CHEMIN GOSFORD,46.8897,-71.5272
02PD010,Regulated,02PD010_Annual_Flow_tab.csv,"SAINT-CHARLES (RIVIERE) Ë 0,8 KM EN AMONT DE LA RIVIERE LORETTE",46.8142,-71.3175
02PF001,Regulated,02PF001_Annual_Flow_tab.csv,MALBAIE (RIVIERE) A CLERMONT,47.6942,-70.2169
02PJ005,Regulated,02PJ005_Annual_Flow_tab.csv,CHAUDIERE (RIVIERE) AU PONT-ROUTE 218 Ë SAINT-LAMBERT-DE-LAUZON,46.5878,-71.2164
02QB001,Regulated,02QB001_Annual_Flow_tab.csv,"MATANE (RIVIERE) Ë 8,5 KM EN AMONT DU PONT-ROUTE 132 Ë MATANE",48.7747,-67.5419
02RH015,Regulated,02RH015_Annual_Flow_tab.csv,CHICOUTIMI (RIVIERE) EN AVAL DU BARRAGE PORTAGE DES ROCHES,48.3042,-71.1944
05JE001,Regulated,05JE001_Peak_Flow_tab.csv,MOOSE JAW RIVER ABOVE THUNDER CREEK,50.3461,-105.53
05JE006,Regulated,05JE006_Annual_Flow_tab.csv,MOOSE JAW RIVER NEAR BURDICK,50.4003,-105.398
05JE006,Regulated,05JE006_Peak_Flow_tab.csv,MOOSE JAW RIVER NEAR BURDICK,50.4003,-105.398
05JK002,Regulated,05JK002_Annual_Flow_tab.csv,QU'APPELLE RIVER BELOW CRAVEN DAM,50.7065,-104.798
05JK002,Regulated,05JK002_Peak_Flow_tab.csv,QU'APPELLE RIVER BELOW CRAVEN DAM,50.7065,-104.798
05NB001,Regulated,05NB001_Annual_Flow_tab.csv,LONG CREEK NEAR ESTEVAN,49.1021,-103.017
05NB001,Regulated,05NB001_Peak_Flow_tab.csv,LONG CREEK NEAR ESTEVAN,49.1021,-103.017
05JF001,Regulated,05JF001_Annual_Flow_tab.csv,QU'APPELLE RIVER NEAR LUMSDEN,50.6505,-104.867
05JF001,Regulated,05JF001_Peak_Flow_tab.csv,QU'APPELLE RIVER NEAR LUMSDEN,50.6505,-104.867